{
  "name": "DatePicker",
  "category": "form",
  "description": "Date selection control",
  "props": {
    "value": { "type": "string" },
    "min": { "type": "string" },
    "max": { "type": "string" },
    "disabled": { "type": "boolean", "default": false },
    "onChange": { "type": "function" }
  },
  "events": ["onChange"],
  "accessibility": ["aria-haspopup"],
  "version": "0.1.0"
}
