{
  "name": "TextArea",
  "category": "form",
  "description": "Multi-line text input field",
  "props": {
    "value": { "type": "string" },
    "placeholder": { "type": "string" },
    "rows": { "type": "number" },
    "disabled": { "type": "boolean", "default": false },
    "onChange": { "type": "function" }
  },
  "events": ["onChange"],
  "accessibility": ["aria-label"],
  "version": "0.1.0"
}
